Feature_Category,Feature_Name,Description,Implementation_Method
Threat Detection,Real-time Monitoring,Continuous monitoring of database activities,MongoDB Change Streams + ML Models
Auto-healing,Self-repair System,Automatic fixing of database issues,Automated Scripts + Health Checks
Intrusion Prevention,Attack Blocking,Block suspicious activities immediately,Pattern Recognition + Firewall Rules
Vulnerability Management,Auto-patching,Automatic security updates,Scheduled Security Patches
Anomaly Detection,Behavior Analysis,Detect unusual user patterns,Machine Learning Algorithms
Backup Management,Auto-backup,Automated data backup and recovery,Scheduled Backups + Encryption
Performance Optimization,Query Optimization,Improve database performance,Index Management + Query Analysis
Incident Response,Emergency Response,Automatic response to security incidents,Alert System + Auto-remediation
